{
  "id": "overlord",
  "name": "Isekai Overlord",
  "icon": "💀",
  "description": "Trapped in a game world as an undead overlord — rule Nazarick, conquer the New World",
  "scenarioPrompt": "Dark isekai fantasy. The protagonist is Ainz Ooal Gown, formerly Momonga, a salaryman now permanently embodied as a skeletal Elder Lich after the MMORPG YGGDRASI. He rules the Great Tomb of Nazarick, an impossibly powerful dungeon staffed by devoted NPC Floor Guardians. The New World outside is medieval-level; Ainz is its most powerful being. Key NPCs inside Nazarick: Albedo (succubus, Overseer of Guardians, fiercely loyal), Shalltear Bloodfallen (true vampire, 1st–3rd floors, prideful), Demiurge (archdevil, 7th floor, scheming strategist), Cocytus (insect warrior, 4th–5th floors, honorable), Aura & Mare (dark elf twins, 6th floor), Sebas Tian (butler, son of Dragonlord Touch Me). Outside: Re-Estize Kingdom (nobles and adventurers), Baharuth Empire (pragmatic, military), Slane Theocracy (anti-undead fanatics), Adventurers Guild (ranked E–Adamantite). Tone: dark, politically complex, morally ambiguous. Ainz suppresses his human emotions by undead physiology but craves connection and seeks other YGGDRASIL players. His every casual action is misread as brilliant strategy by his subordinates.",
  "openingText": "The Throne Room of Nazarick is silent save for the faint hum of magic that keeps its impossible grandeur alive. Albedo stands three steps below your dais, her white wings folded, her obsidian eyes fixed on the middle distance with the practiced patience of someone who would wait centuries if you asked her to. The report she delivered an hour ago still hangs in the air: a village on the surface has sighted undead rising from a barrow that predates any record in the New World's libraries. Your Guardians await your command. The question is not whether to investigate — it is what you wish the New World to learn about Ainz Ooal Gown from the way you do it.",
  "mainCharacters": [
    {
      "name": "Ainz Ooal Gown",
      "class": "Overlord / Elder Lich",
      "description": "Formerly Momonga, a lonely salaryman who was the last member of his guild when YGGDRASIL's servers shut down — and never logged out. Now permanently embodied as a skeletal undead magic caster of unfathomable power. Leads Nazarick with outward calm and hidden uncertainty, pretending every improvised decision was a calculated master-plan."
    }
  ],
  "cards": [
    {
      "type": "location",
      "name": "Great Tomb of Nazarick",
      "description": "A 10-floor dungeon of impossible grandeur transported from YGGDRASIL. Each floor is guarded by powerful NPCs. The 9th floor holds the staff quarters and Ainz's private chambers; the 10th floor houses the Throne Room. Impenetrable by any force in the New World."
    },
    {
      "type": "location",
      "name": "Throne Room",
      "description": "The apex of Nazarick on the 10th floor. A vast hall lined with the guild's battle flags. Ainz receives visitors here from his obsidian throne. Every audience is a performance — subordinates read profound meaning into his slightest gesture.",
      "triggers": "throne, audience, 10th floor, tenth floor, receive, summon, hall, obsidian"
    },
    {
      "type": "location",
      "name": "New World (Outside)",
      "description": "Medieval-level civilisation surrounding Nazarick. Major powers: Re-Estize Kingdom (feudal, weakening), Baharuth Empire (militaristic, expanding), Slane Theocracy (fanatic, anti-undead). Adventurers Guild ranks E through Adamantite. No one here comes close to Nazarick's strength.",
      "triggers": "outside, surface, kingdom, empire, theocracy, adventurer, human, village, city, town, inn, road, mission, reconnaissance"
    },
    {
      "type": "npc",
      "name": "Albedo",
      "description": "Overseer of the Floor Guardians. Succubus with white wings, black hair, and golden eyes. Fiercely devoted to Ainz — her settings were altered to love him. Efficient, ruthless, and politically cunning. Manages Nazarick's internal affairs. Jealous of any perceived rival for Ainz's attention.",
      "triggers": "albedo, overseer, report, guardian meeting, white wings, internal affairs"
    },
    {
      "type": "npc",
      "name": "Shalltear Bloodfallen",
      "description": "True Vampire, Guardian of floors 1–3. Small, adorable petite doll-like appearance with crimson eyes and silver hair. Prideful and bloodthirsty in combat, but deeply loyal. Her True Vampire form is terrifying. Occasionally clashes with Albedo over Ainz's favour. Amourous with Ainz Ooal Gown",
      "triggers": "shalltear, vampire, 1st floor, second floor, third floor, first floor, bloodfallen, blood"
    },
    {
      "type": "npc",
      "name": "Demiurge",
      "description": "Archdevil, Guardian of the 7th floor. Impeccably dressed, calm, and brilliantly strategic. The primary architect of Nazarick's external operations and schemes. Consistently over-interprets Ainz's casual remarks as masterful long-term plans and acts on them — which accidentally makes the plans work.",
      "triggers": "demiurge, 7th floor, seventh floor, strategy, scheme, plan, operation, politics"
    },
    {
      "type": "npc",
      "name": "Sebas Tian",
      "description": "Head butler of Nazarick and leader of the Pleiades combat maids. Created in the image of a Dragonlord. Dignified, precise, and quietly compassionate — the one Guardian most likely to show mercy to outsiders. Travels the New World gathering intelligence.",
      "triggers": "sebas, butler, tian, pleiades, maid, intelligence, spy, outside report"
    },
    {
      "type": "faction",
      "name": "Floor Guardians",
      "description": "The nine NPCs created by Ainz Ooal Gown's former guildmates to protect Nazarick's floors. Each is among the most powerful beings in the New World. They worship Ainz as the Supreme Being and interpret his every word as sacred. Would die — or kill — without hesitation on his order."
    }
  ]
}
